{
  "class": "AS3",
  "action": "deploy",
  "persist": true,
  "declaration": {
    "class": "ADC",
    "schemaVersion": "3.15.0",
    "id": "service-sctp",
    "label": "Sample Service_SCTP",
    "remark": "Simple SCTP application reference",
    "Sample_sctp_01": {
      "class": "Tenant",
      "mySCTP": {
        "class": "Application",
        "service": {
          "class": "Service_SCTP",
          "virtualAddresses": [
            "10.0.1.10"
          ],
          "virtualPort": 132,
          "profileSCTP": {
            "bigip": "/Common/sctp"
          }
        }
      }
    }
  }
}
