{
  "class": "AS3",
  "action": "deploy",
  "persist": true,
  "declaration": {
    "class": "ADC",
    "schemaVersion": "3.0.0",
    "id": "lmnop543421",
    "label": "Sample 4",
    "remark": "An HTTP and an HTTPS application",
    "controls": {
      "trace": true
    },
    "Sample_http_04": {
      "class": "Tenant",
      "A1": {
        "class": "Application",
        "service": {
          "class": "Service_HTTP",
          "virtualAddresses": [
            "10.0.9.10"
          ],
          "pool": "gce_pool"
        },
        "gce_pool": {
          "class": "Pool",
          "monitors": [
            "http"
          ],
          "members": [{
            "servicePort": 80,
            "serverAddresses": [
              "192.0.7.10",
              "192.0.7.11"
            ]
          }]
        }
      },
      "A2": {
        "class": "Application",
        "service": {
          "class": "Service_HTTPS",
          "virtualAddresses": [
            "10.0.9.20"
          ],
          "pool": "web_pool",
          "serverTLS": "webtls"
        },
        "web_pool": {
          "class": "Pool",
          "monitors": [
            "http"
          ],
          "members": [{
            "servicePort": 80,
            "serverAddresses": [
              "192.0.9.10",
              "192.0.9.11"
            ]
          }]
        },
        "webtls": {
          "class": "TLS_Server",
          "certificates": [{
            "certificate": "webcert"
          }]
        },
        "webcert": {
          "class": "Certificate",
          "remark": "in practice we recommend using a passphrase",
          "certificate": "-----BEGIN CERTIFICATE-----\nMIICnDCCAgWgAwIBAgIJAJ5n2b0OCEjwMA0GCSqGSIb3DQEBCwUAMGcxCzAJBgNVBAYTAlVTMRMwEQYDVQQIDApXYXNoaW5ndG9uMRAwDgYDVQQHDAdTZWF0dGxlMRQwEgYDVQQKDAtmNV9OZXR3b3JrczEbMBkGA1UEAwwSc2FtcGxlLmV4YW1wbGUubmV0MB4XDTE3MTEyNjE5NTAyNFoXDTE4MDIyNTE5NTAyNFowZzELMAkGA1UEBhMCVVMxEzARBgNVBAgMCldhc2hpbmd0b24xEDAOBgNVBAcMB1NlYXR0bGUxFDASBgNVBAoMC2Y1X05ldHdvcmtzMRswGQYDVQQDDBJzYW1wbGUuZXhhbXBsZS5uZXQwgZ8wDQYJKoZIhvcNAQEBBQADgY0AMIGJAoGBALEsuXmSXVQpYjrZPW+WiTBjn491mwZYT7Q92V1HlSBtM6WdWlK1aZN5sovfKtOX7Yrm8xa+e4o/zJ2QYLyyv5O+t2EGN/4qUEjEAPY9mwJdfzRQy6Hyzm84J0QkTuUJ/EjNuPji3D0QJRALUTzu1UqqDCEtiN9OGyXEkh7uvb7BAgMBAAGjUDBOMB0GA1UdDgQWBBSVHPNrGWrjWyZvckQxFYWO59FRFjAfBgNVHSMEGDAWgBSVHPNrGWrjWyZvckQxFYWO59FRFjAMBgNVHRMEBTADAQH/MA0GCSqGSIb3DQEBCwUAA4GBAJeJ9SEckEwPhkXOm+IuqfbUS/RcziifBCTmVyE+Fa/j9pKSYTgiEBNdbJeBEa+gPMlQtbV7Y2dy8TKx/8axVBHiXC5geDML7caxOrAyHYBpnx690xJTh5OIORBBM/a/NvaR+P3CoVebr/NPRh9oRNxnntnqvqD7SW0U3ZPe3tJc\n-----END CERTIFICATE-----",
          "chainCA": "-----BEGIN CERTIFICATE-----\nMIID9TCCAt2gAwIBAgIJALxQA/NW2bpRMA0GCSqGSIb3DQEBCwUAMIGQMQswCQYDVQQGEwJVUzETMBEGA1UECAwKV2FzaGluZ3RvbjEQMA4GA1UEBwwHU2VhdHRsZTELMAkGA1UECgwCRjUxDTALBgNVBAsMBFRlc3QxFzAVBgNVBAMMDnRlc3RfQ0FfYnVuZGxlMSUwIwYJKoZIhvcNAQkBFhZzb21lYm9keUBzb21ld2hlcmUub3JnMB4XDTE4MDIyNzE5MjEyNVoXDTE4MDMyOTE5MjEyNVowgZAxCzAJBgNVBAYTAlVTMRMwEQYDVQQIDApXYXNoaW5ndG9uMRAwDgYDVQQHDAdTZWF0dGxlMQswCQYDVQQKDAJGNTENMAsGA1UECwwEVGVzdDEXMBUGA1UEAwwOdGVzdF9DQV9idW5kbGUxJTAjBgkqhkiG9w0BCQEWFnNvbWVib2R5QHNvbWV3aGVyZS5vcmcwggEiMA0GCSqGSIb3DQEBAQUAA4IBDwAwggEKAoIBAQCjhUZmbwwuMMFTNic73t0mfJ/pyM3BnEs0riv6lbrF5znFKBlAM2pxWBfkQvr92gUwitij7BqMagnR26/C7GcJJNJQGNK482vgSPhUpGeN0t4W71Dv5SpwJN+0do6gV0eXPwvcgA/XZxXqZAePwXTp36YMrNTgw49OWZpHoNXfYCZ+1KUL032RdQ/Ik2wO/UwV0csL1Rwuu2L8/NI9VtrThCAr8dsMsDJ53jDh7xQdP3K2V9NYtAHk66697kk7TpzR1moqTJxSVaPKo2eDuKNke1BRbjYWoamu0hfC5YG6l5P9i8QaVklbtmDcmoLpU9fLVSSW6CWHkrtdifQiCOChAgMBAAGjUDBOMB0GA1UdDgQWBBRv7/Q0VoBgDYzgJOKLz4GsgXP27zAfBgNVHSMEGDAWgBRv7/Q0VoBgDYzgJOKLz4GsgXP27zAMBgNVHRMEBTADAQH/MA0GCSqGSIb3DQEBCwUAA4IBAQA9r6+6hGVlQ188l+wLFJ1wI83y27BdtE0ZsZGdFv98qi9kcUm17Z0tprEwypODZ1/syt9b1JhD4RgU30qwgeF4kec8UpoG49UkQImRD3AqfsiYSdjZeBpcpEl3n8lkjKGoVY7GB2lMGoWDxv/1A0CSjVTmWgQSFGHoMtzOW1tCr9yGXVEdy691l7PVC1kK5ekwkO8YbSO6hvV/u83KuUiGcIoY1PIzAK301i9YXWUNxybIVfHregoQ11QzjhfdfpOLBTtW1B4QZqZz8qFGIr1remmQK3ljEcct9bWjMLOx2QYMvk6uRFzh+V5L2UnhldNy5wQYMXRDz6SU3LdTJ2OA\n-----END CERTIFICATE-----",
          "privateKey": "-----BEGIN RSA PRIVATE KEY-----\nProc-Type: 4,ENCRYPTED\nDEK-Info: AES-256-CBC,D8FFCE6B255601587CB54EC29B737D31\n\nkv4Fc3Jn0Ujkj0yRjt+gQQfBLSNF2aRLUENXnlr7Xpzqu0Ahr3jS1bAAnd8IWnsR\nyILqVmKsYF2DoHh0tWiEAQ7/y/fe5DTFhK7N4Wml6kp2yVMkP6KC4ssyYPw27kjK\nDBwBZ5O8Ioej08A5sgsLCmglbmtSPHJUn14pQnMTmLOpEtOsu6S+2ibPgSNpdg0b\nCAJNG/KHe+Vkx59qNDyDeKb7FZOlsX30+y67zUq9GQqJEDuysPJ2BUNP0IJXAjst\nFIt1qNoZew+5KDYs7u/lPxcMGTirUhgI84Jy4WcDvSOsP/tKlxj04TbIE3epmSKy\n+TihHkwY7ngIGtcm3Sfqk5jz2RXoj1/Ac3SW8kVTYaOUogBhn7zAq4Wju6Et4hQG\nRGapsJp1aCeZ/a4RCDTxspcKoMaRa97/URQb0hBRGx3DGUhzpmX9zl7JI2Xa5D3R\nmdBXtjLKYJTdIMdd27prBEKhMUpae2rz5Mw4J907wZeBq/wu+zp8LAnecfTe2nGY\nE32x1U7gSEdYOGqnwxsOexb1jKgCa67Nw9TmcMPV8zmH7R9qdvgxAbAtwBl1F9OS\nfcGaC7epf1AjJLtaX7krWmzgASHl28Ynh9lmGMdv+5QYMZvKG0LOg/n3m8uJ6sKy\nIzzvaJswwn0j5P5+czyoV5CvvdCfKnNb+3jUEN8I0PPwjBGKr4B1ojwhogTM248V\nHR69D6TxFVMfGpyJhCPkbGEGbpEpcffpgKuC/mEtMqyDQXJNaV5HO6HgAJ9F1P6v\n5ehHHTMRvzCCFiwndHdlMXUjqSNjww6me6dr6LiAPbejdzhL2vWx1YqebOcwQx3G\n-----END RSA PRIVATE KEY-----",
          "passphrase": {
            "ciphertext": "ZjVmNQ==",
            "protected": "eyJhbGciOiJkaXIiLCJlbmMiOiJub25lIn0"
          }
        }
      }
    }
  }
}
